{
  "comparisons": [
    {
      "absolute_error": 411.2411794056534,
      "actual": 127300.38931220102,
      "family": "compensation",
      "metric": "compensation.average",
      "observable": true,
      "percent_error": 0.003230478568271262,
      "period": 2025,
      "predicted": 127711.63049160667,
      "spread": {
        "actual_within_spread": true,
        "distance_outside": null,
        "maximum": 127776.85870503585,
        "minimum": 127215.2145323741,
        "seed_count": 3,
        "values": [
          127776.85870503585,
          127711.63049160667,
          127215.2145323741
        ]
      },
      "status": "pass",
      "threshold": {
        "fail": 0.06,
        "warn": 0.03
      },
      "unobservable_reason": null
    },
    {
      "absolute_error": 411.2411794056534,
      "actual": 127300.38931220102,
      "family": "compensation",
      "metric": "compensation.average",
      "observable": true,
      "percent_error": 0.003230478568271262,
      "period": "cumulative",
      "predicted": 127711.63049160667,
      "spread": {
        "actual_within_spread": true,
        "distance_outside": null,
        "maximum": 127776.85870503585,
        "minimum": 127215.2145323741,
        "seed_count": 3,
        "values": [
          127776.85870503585,
          127711.63049160667,
          127215.2145323741
        ]
      },
      "status": "pass",
      "threshold": {
        "fail": 0.06,
        "warn": 0.03
      },
      "unobservable_reason": null
    },
    {
      "absolute_error": 176748.72999984026,
      "actual": 212846250.9300001,
      "family": "compensation",
      "metric": "compensation.total",
      "observable": true,
      "percent_error": 0.0008304056530362312,
      "period": 2025,
      "predicted": 213022999.65999994,
      "spread": {
        "actual_within_spread": true,
        "distance_outside": null,
        "maximum": 213131800.31999978,
        "minimum": 212194977.84,
        "seed_count": 3,
        "values": [
          213131800.31999978,
          213022999.65999994,
          212194977.84
        ]
      },
      "status": "pass",
      "threshold": {
        "fail": 0.06,
        "warn": 0.03
      },
      "unobservable_reason": null
    },
    {
      "absolute_error": 176748.72999984026,
      "actual": 212846250.9300001,
      "family": "compensation",
      "metric": "compensation.total",
      "observable": true,
      "percent_error": 0.0008304056530362312,
      "period": "cumulative",
      "predicted": 213022999.65999994,
      "spread": {
        "actual_within_spread": true,
        "distance_outside": null,
        "maximum": 213131800.31999978,
        "minimum": 212194977.84,
        "seed_count": 3,
        "values": [
          213131800.31999978,
          213022999.65999994,
          212194977.84
        ]
      },
      "status": "pass",
      "threshold": {
        "fail": 0.06,
        "warn": 0.03
      },
      "unobservable_reason": null
    },
    {
      "absolute_error": 16.0,
      "actual": 225.0,
      "family": "flows",
      "metric": "flows.hires",
      "observable": true,
      "percent_error": 0.07111111111111111,
      "period": 2025,
      "predicted": 241.0,
      "spread": {
        "actual_within_spread": false,
        "distance_outside": -16.0,
        "maximum": 241.0,
        "minimum": 241.0,
        "seed_count": 3,
        "values": [
          241.0,
          241.0,
          241.0
        ]
      },
      "status": "pass",
      "threshold": {
        "fail": 0.2,
        "warn": 0.1
      },
      "unobservable_reason": null
    },
    {
      "absolute_error": 16.0,
      "actual": 225.0,
      "family": "flows",
      "metric": "flows.hires",
      "observable": true,
      "percent_error": 0.07111111111111111,
      "period": "cumulative",
      "predicted": 241.0,
      "spread": {
        "actual_within_spread": false,
        "distance_outside": -16.0,
        "maximum": 241.0,
        "minimum": 241.0,
        "seed_count": 3,
        "values": [
          241.0,
          241.0,
          241.0
        ]
      },
      "status": "pass",
      "threshold": {
        "fail": 0.2,
        "warn": 0.1
      },
      "unobservable_reason": null
    },
    {
      "absolute_error": -2.0,
      "actual": 99.0,
      "family": "flows",
      "metric": "flows.promotions",
      "observable": true,
      "percent_error": -0.020202020202020204,
      "period": 2025,
      "predicted": 97.0,
      "spread": {
        "actual_within_spread": true,
        "distance_outside": null,
        "maximum": 111.0,
        "minimum": 89.0,
        "seed_count": 3,
        "values": [
          97.0,
          111.0,
          89.0
        ]
      },
      "status": "pass",
      "threshold": {
        "fail": 0.2,
        "warn": 0.1
      },
      "unobservable_reason": null
    },
    {
      "absolute_error": -2.0,
      "actual": 99.0,
      "family": "flows",
      "metric": "flows.promotions",
      "observable": true,
      "percent_error": -0.020202020202020204,
      "period": "cumulative",
      "predicted": 97.0,
      "spread": {
        "actual_within_spread": true,
        "distance_outside": null,
        "maximum": 111.0,
        "minimum": 89.0,
        "seed_count": 3,
        "values": [
          97.0,
          111.0,
          89.0
        ]
      },
      "status": "pass",
      "threshold": {
        "fail": 0.2,
        "warn": 0.1
      },
      "unobservable_reason": null
    },
    {
      "absolute_error": 12.0,
      "actual": 131.0,
      "family": "flows",
      "metric": "flows.terminations",
      "observable": true,
      "percent_error": 0.0916030534351145,
      "period": 2025,
      "predicted": 143.0,
      "spread": {
        "actual_within_spread": false,
        "distance_outside": -12.0,
        "maximum": 143.0,
        "minimum": 143.0,
        "seed_count": 3,
        "values": [
          143.0,
          143.0,
          143.0
        ]
      },
      "status": "pass",
      "threshold": {
        "fail": 0.2,
        "warn": 0.1
      },
      "unobservable_reason": null
    },
    {
      "absolute_error": 12.0,
      "actual": 131.0,
      "family": "flows",
      "metric": "flows.terminations",
      "observable": true,
      "percent_error": 0.0916030534351145,
      "period": "cumulative",
      "predicted": 143.0,
      "spread": {
        "actual_within_spread": false,
        "distance_outside": -12.0,
        "maximum": 143.0,
        "minimum": 143.0,
        "seed_count": 3,
        "values": [
          143.0,
          143.0,
          143.0
        ]
      },
      "status": "pass",
      "threshold": {
        "fail": 0.2,
        "warn": 0.1
      },
      "unobservable_reason": null
    },
    {
      "absolute_error": 94.0,
      "actual": 342.0,
      "family": "headcount",
      "metric": "headcount.by_age_band.25-34",
      "observable": true,
      "percent_error": 0.27485380116959063,
      "period": 2025,
      "predicted": 436.0,
      "spread": {
        "actual_within_spread": false,
        "distance_outside": -78.0,
        "maximum": 438.0,
        "minimum": 420.0,
        "seed_count": 3,
        "values": [
          420.0,
          438.0,
          436.0
        ]
      },
      "status": "fail",
      "threshold": {
        "fail": 0.04,
        "warn": 0.02
      },
      "unobservable_reason": null
    },
    {
      "absolute_error": 94.0,
      "actual": 342.0,
      "family": "headcount",
      "metric": "headcount.by_age_band.25-34",
      "observable": true,
      "percent_error": 0.27485380116959063,
      "period": "cumulative",
      "predicted": 436.0,
      "spread": {
        "actual_within_spread": false,
        "distance_outside": -78.0,
        "maximum": 438.0,
        "minimum": 420.0,
        "seed_count": 3,
        "values": [
          420.0,
          438.0,
          436.0
        ]
      },
      "status": "fail",
      "threshold": {
        "fail": 0.04,
        "warn": 0.02
      },
      "unobservable_reason": null
    },
    {
      "absolute_error": -11.0,
      "actual": 433.0,
      "family": "headcount",
      "metric": "headcount.by_age_band.35-44",
      "observable": true,
      "percent_error": -0.025404157043879907,
      "period": 2025,
      "predicted": 422.0,
      "spread": {
        "actual_within_spread": true,
        "distance_outside": null,
        "maximum": 441.0,
        "minimum": 419.0,
        "seed_count": 3,
        "values": [
          441.0,
          422.0,
          419.0
        ]
      },
      "status": "warn",
      "threshold": {
        "fail": 0.04,
        "warn": 0.02
      },
      "unobservable_reason": null
    },
    {
      "absolute_error": -11.0,
      "actual": 433.0,
      "family": "headcount",
      "metric": "headcount.by_age_band.35-44",
      "observable": true,
      "percent_error": -0.025404157043879907,
      "period": "cumulative",
      "predicted": 422.0,
      "spread": {
        "actual_within_spread": true,
        "distance_outside": null,
        "maximum": 441.0,
        "minimum": 419.0,
        "seed_count": 3,
        "values": [
          441.0,
          422.0,
          419.0
        ]
      },
      "status": "warn",
      "threshold": {
        "fail": 0.04,
        "warn": 0.02
      },
      "unobservable_reason": null
    },
    {
      "absolute_error": -38.0,
      "actual": 437.0,
      "family": "headcount",
      "metric": "headcount.by_age_band.45-54",
      "observable": true,
      "percent_error": -0.08695652173913043,
      "period": 2025,
      "predicted": 399.0,
      "spread": {
        "actual_within_spread": false,
        "distance_outside": 33.0,
        "maximum": 404.0,
        "minimum": 395.0,
        "seed_count": 3,
        "values": [
          404.0,
          395.0,
          399.0
        ]
      },
      "status": "fail",
      "threshold": {
        "fail": 0.04,